<!DOCTYPE tokenList SYSTEM "tokenList.dtd">
<!-- See the DTD for more details -->
<!-- value = a reference to suffixRules.xml -->   
<tokenList tagname="suffix" type="charge" symbol="I">
  <token value="ium">ium</token>
  <token value="ide">ide</token>
  <token value="ide">id</token>
  <token value="ylium">ylium</token>
  <token value="ylium">(ylium)</token>
  <token value="uide">uide</token>
  <token value="uide">uid</token>
</tokenList>
